{
  "$schema": "./current.schema.json",
  "schema_version": 1,
  "generated_at": "2026-05-19T00:43:00Z",
  "spec_sources": {
    "spec_md": {
      "path": "SPECIFICATION/spec.md",
      "git_blob_sha": "353473a7c197df5f1423cb5c578c8401a5f6ada6"
    },
    "contracts_md": {
      "path": "SPECIFICATION/contracts.md",
      "git_blob_sha": "2e46b17593bf2bb1573f17302ec1c41a48dfab10"
    },
    "constraints_md": {
      "path": "SPECIFICATION/constraints.md",
      "git_blob_sha": "2253eed3bc425c1b74b0c61d45edbba020fb2b48"
    },
    "scenarios_md": {
      "path": "SPECIFICATION/scenarios.md",
      "git_blob_sha": "14775905a98793ac49f751063482e1e8a192b071"
    },
    "non_functional_requirements_md": {
      "path": "SPECIFICATION/non-functional-requirements.md",
      "git_blob_sha": "fb6a4ed72096ed923110d9ee9e1f1802a7264ef4"
    }
  },
  "inspection": {
    "scopes_inspected": [
      "SPECIFICATION/",
      ".claude-plugin/",
      ".claude/skills/",
      "dev-tooling/implementation/",
      "implementation-gaps/",
      "tests/dev-tooling/",
      "justfile",
      "implementation.just",
      ".mise.toml",
      ".gitignore",
      ".beads/"
    ],
    "scopes_skipped": [
      {
        "scope": "live-system runtime probes",
        "reason": "livespec has no live system to probe (no DB / no edge functions); inspection is static-only"
      }
    ],
    "run_id": "8fee0664-d07b-4846-9f86-a8f71a14512d",
    "inspection_method": "static \u2014 dev-tooling/implementation/refresh_gaps.py walked the repo via hardcoded gap-detection predicates"
  },
  "gaps": [],
  "summary": {
    "by_area": {},
    "by_severity": {},
    "by_status": {
      "open": 0
    }
  }
}
